<?xml version="1.0" encoding="utf-8"?>
<itemCorrelationRules xmlns:xsi="http://www.w3.org/2001/XMLSchema-instance" xsi:noNamespaceSchemaLocation="../xsd/item-correlation-rule.xsd">
	<itemCorrelationRule id="opp-stage-corr" name="Opportunity - Stage correlation">
		<triggerItem qualifiedId="customer.opportunity">
		</triggerItem>		
		<relatedItems>
			<!-- Priority Documents by stages -->
			<relatedItem qualifiedId="solution">
				<filterCriteria>
					<filter>
						<attributeId>identity</attributeId>
						<parentAttribute>oppSolutions</parentAttribute>
					</filter>
				</filterCriteria>
				<recordAsRelated>true</recordAsRelated>
				<tags>
					<tag>SOLN_DOC</tag>
				</tags>
				<!-- Product datasheet is correlated for qualification stage -->
				<relatedItems>				
					<relatedItem qualifiedId="product.dataSheet">
						<filterCriteria>
							<filter>
								<attributeId>__associations.parent.recordIdentity</attributeId>
								<parentAttribute>products</parentAttribute>
							</filter>
						</filterCriteria>
						<recordAsRelated>true</recordAsRelated>
						<tags>
							<tag>PRIORITY_Qualification</tag>
						</tags>
					</relatedItem>
				</relatedItems>				
			</relatedItem>
			<!-- Solution Overview is correlated for qualification stage -->				
			<relatedItem qualifiedId="solution.solOverview">
				<filterCriteria>
					<filter>
						<attributeId>__associations.parent.recordIdentity</attributeId>
						<parentAttribute>oppSolutions</parentAttribute>
					</filter>
				</filterCriteria>
				<recordAsRelated>true</recordAsRelated>
				<tags>
					<tag>PRIORITY_Qualification</tag>
					<tag>SOLN_DOC</tag>
				</tags>
			</relatedItem>	
			<!-- Discovery Questions are correlated for qualification stage -->				
			<relatedItem qualifiedId="discoveryQuestion">
				<filterCriteria>
					<filter>
						<attributeId>solutions</attributeId>
						<parentAttribute>oppSolutions</parentAttribute>
					</filter>
				</filterCriteria>
				<recordAsRelated>true</recordAsRelated>
				<tags>
					<tag>PRIORITY_Qualification</tag>
					<tag>SOLN_DOC</tag>
				</tags>
			</relatedItem>					
			<!-- Executive Summary is correlated for proposal stage -->				
			<relatedItem qualifiedId="execSummary">
				<filterCriteria>
					<filter>
						<attributeId>solutions</attributeId>
						<parentAttribute>oppSolutions</parentAttribute>
					</filter>
				</filterCriteria>
				<recordAsRelated>true</recordAsRelated>
				<tags>
					<tag>PRIORITY_Proposal</tag>
					<tag>SOLN_DOC</tag>
				</tags>
			</relatedItem>	
			<!-- Proposal is correlated for proposal stage based on solution and competitor-->				
			<relatedItem qualifiedId="proposal">
				<filterCriteria>
					<filter>
						<attributeId>solutions</attributeId>
						<parentAttribute>oppSolutions</parentAttribute>
					</filter>
					<filter>
						<attributeId>competitors</attributeId>
						<parentAttribute>oppCompetitors</parentAttribute>
					</filter>					
				</filterCriteria>
				<recordAsRelated>true</recordAsRelated>
				<tags>
					<tag>PRIORITY_Proposal</tag>
				</tags>
			</relatedItem>									
			<!-- Sales Deck is correlated for value proposition stage -->				
			<relatedItem qualifiedId="salesDeck">
				<filterCriteria>
					<filter>
						<attributeId>solutions</attributeId>
						<parentAttribute>oppSolutions</parentAttribute>
					</filter>
				</filterCriteria>
				<recordAsRelated>true</recordAsRelated>
				<tags>
					<tag>PRIORITY_Value Proposition</tag>
					<tag>SOLN_DOC</tag>
				</tags>
			</relatedItem>	
			<!-- Case Study is correlated for value proposition stage based on solution and competitor -->				
			<relatedItem qualifiedId="caseStudy">
				<filterCriteria>
					<filter>
						<attributeId>solutions</attributeId>
						<parentAttribute>oppSolutions</parentAttribute>
					</filter>
					<filter>
						<attributeId>competitors</attributeId>
						<parentAttribute>oppCompetitors</parentAttribute>
					</filter>					
				</filterCriteria>
				<recordAsRelated>true</recordAsRelated>
				<tags>
					<tag>PRIORITY_Value Proposition</tag>
					<tag>SOLN_DOC</tag>
					<tag>COMP_DOC</tag>					
				</tags>
			</relatedItem>	
			<!-- Win Loss Analysis is correlated for value proposition stage based on solution and competitor -->				
			<relatedItem qualifiedId="winloss">
				<filterCriteria>
					<filter>
						<attributeId>solutions</attributeId>
						<parentAttribute>oppSolutions</parentAttribute>
					</filter>
					<filter>
						<attributeId>competitors</attributeId>
						<parentAttribute>oppCompetitors</parentAttribute>
					</filter>					
				</filterCriteria>
				<recordAsRelated>true</recordAsRelated>
				<tags>
					<tag>PRIORITY_Value Proposition</tag>
					<tag>PRIORITY_Negotiation</tag>
					<tag>COMP_DOC</tag>					
				</tags>
			</relatedItem>		
			<!-- Solution Documents in addition to the one already tagged -->
			<!-- Blogs that are correlated to the solution -->				
			<relatedItem qualifiedId="blog">
				<filterCriteria>
					<filter>
						<attributeId>solutions</attributeId>
						<parentAttribute>oppSolutions</parentAttribute>
					</filter>
				</filterCriteria>
				<recordAsRelated>true</recordAsRelated>
				<tags>
					<tag>SOLN_DOC</tag>
				</tags>
			</relatedItem>				
			<!-- Whitepapers that are correlated to the solution -->				
			<relatedItem qualifiedId="whitepaper">
				<filterCriteria>
					<filter>
						<attributeId>solutions</attributeId>
						<parentAttribute>oppSolutions</parentAttribute>
					</filter>
				</filterCriteria>
				<recordAsRelated>true</recordAsRelated>
				<tags>
					<tag>SOLN_DOC</tag>
				</tags>
			</relatedItem>	
			<!-- Competitor documents in addition to the one already tagged -->
			<!-- Competitor link -->
			<relatedItem qualifiedId="competitor">
				<filterCriteria>
					<filter>
						<attributeId>identity</attributeId>
						<parentAttribute>oppCompetitors</parentAttribute>
					</filter>
				</filterCriteria>
				<recordAsRelated>true</recordAsRelated>
				<tags>
					<tag>COMP_DOC</tag>
				</tags>			
			</relatedItem>	
			<!-- Competitor SWOT -->								
			<relatedItem qualifiedId="competitor.compswot">
				<filterCriteria>
					<filter>
						<attributeId>__associations.parent.recordIdentity</attributeId>
						<parentAttribute>oppCompetitors</parentAttribute>
					</filter>
				</filterCriteria>
				<recordAsRelated>true</recordAsRelated>
				<tags>
					<tag>COMP_DOC</tag>
				</tags>
			</relatedItem>
			<!-- Analyst Reports based on competitor -->											
			<relatedItem qualifiedId="analyst.report">
				<filterCriteria>
					<filter>
						<attributeId>competitors</attributeId>
						<parentAttribute>oppCompetitors</parentAttribute>
					</filter>
				</filterCriteria>
				<recordAsRelated>true</recordAsRelated>
				<tags>
					<tag>COMP_DOC</tag>
				</tags>
			</relatedItem>			
			<!-- Process documents based on stages -->			
			<!-- NDA -->
			<relatedItem qualifiedId="nda">
				<recordAsRelated>true</recordAsRelated>
				<tags>
					<tag>PROCESS_Qualification</tag>
					<tag>PROCESS_Value Proposition</tag>					
				</tags>		
			</relatedItem>
			<!-- Pricing Template -->
			<relatedItem qualifiedId="pricingtemplate">
				<recordAsRelated>true</recordAsRelated>
				<tags>
					<tag>PROCESS_Negotiation</tag>
					<tag>PROCESS_Proposal</tag>					
				</tags>		
			</relatedItem>
			<!-- PPT Template -->
			<relatedItem qualifiedId="ppttemplate">
				<recordAsRelated>true</recordAsRelated>
				<tags>
					<tag>PROCESS_Value Proposition</tag>
				</tags>		
			</relatedItem>
			<!-- MSA -->
			<relatedItem qualifiedId="msa">
				<recordAsRelated>true</recordAsRelated>
				<tags>
					<tag>PROCESS_Value Proposition</tag>
					<tag>PROCESS_Negotiation</tag>										
				</tags>		
			</relatedItem>
			<!-- SOW -->
			<relatedItem qualifiedId="sow">
				<recordAsRelated>true</recordAsRelated>
				<tags>
					<tag>PROCESS_Negotiation</tag>										
				</tags>		
			</relatedItem>
		</relatedItems>
	</itemCorrelationRule>		
</itemCorrelationRules>