<?xml version="1.0" encoding="utf-8"?>
<itemCorrelationRules xmlns:xsi="http://www.w3.org/2001/XMLSchema-instance" xsi:noNamespaceSchemaLocation="../xsd/item-correlation-rule.xsd">
	<itemCorrelationRule id="rule11" name="Product Correlation">
		<triggerItem qualifiedId="salesPlay">
		</triggerItem>
		<relatedItems>
			<relatedItem qualifiedId="product">
				<filterCriteria>
					<filter>
						<attributeId>identity</attributeId>
						<parentAttribute>products</parentAttribute>
					</filter>
				</filterCriteria>
				<recordAsRelated>true</recordAsRelated>
				<tags>
					<tag>LINKED_PROD</tag>
				</tags>
			</relatedItem>
		</relatedItems>
	</itemCorrelationRule>
	<itemCorrelationRule id="rule12" name="Solution Correlation">
		<triggerItem qualifiedId="salesPlay">
		</triggerItem>
		<relatedItems>
			<relatedItem qualifiedId="solution">
				<filterCriteria>
					<filter>
						<attributeId>identity</attributeId>
						<parentAttribute>solutions</parentAttribute>
					</filter>
				</filterCriteria>
				<recordAsRelated>true</recordAsRelated>
				<tags>
					<tag>LINKED_SOL</tag>
				</tags>
			</relatedItem>
		</relatedItems>
	</itemCorrelationRule>	
	<itemCorrelationRule id="rule13" name="Competitor Correlation">
		<triggerItem qualifiedId="salesPlay">
		</triggerItem>
		<relatedItems>
			<relatedItem qualifiedId="competitor">
				<filterCriteria>
					<filter>
						<attributeId>identity</attributeId>
						<parentAttribute>competitors</parentAttribute>
					</filter>
				</filterCriteria>
				<recordAsRelated>true</recordAsRelated>
				<tags>
					<tag>LINKED_COMP</tag>
				</tags>
			</relatedItem>
		</relatedItems>
	</itemCorrelationRule>	
	<itemCorrelationRule id="rule14" name="Product Introduction Correlation">
		<triggerItem qualifiedId="salesPlay">
		</triggerItem>
		<relatedItems>
			<relatedItem qualifiedId="product">
				<filterCriteria>
					<filter>
						<attributeId>shortName</attributeId>
						<constant>miRevenue</constant>
					</filter>
				</filterCriteria>
				<recordAsRelated>true</recordAsRelated>
				<tags>
					<tag>INTRO_PROD</tag>
				</tags>
				<relatedItems>
					<relatedItem qualifiedId="battlecard">
						<filterCriteria>
							<filter>
								<attributeId>products</attributeId>
								<parentAttribute>identity</parentAttribute>
							</filter>
						</filterCriteria>
						<recordAsRelated>true</recordAsRelated>
						<tags>
							<tag>PROD_BATTLECARD</tag>
						</tags>
					</relatedItem>				
					<relatedItem qualifiedId="salesDeck">
						<filterCriteria>
							<filter>
								<attributeId>products</attributeId>
								<parentAttribute>identity</parentAttribute>
							</filter>
						</filterCriteria>
						<recordAsRelated>true</recordAsRelated>
						<tags>
							<tag>PROD_SALES_DECK</tag>
						</tags>
					</relatedItem>								
					<relatedItem qualifiedId="whitepaper">
						<filterCriteria>
							<filter>
								<attributeId>products</attributeId>
								<parentAttribute>identity</parentAttribute>
							</filter>
						</filterCriteria>
						<recordAsRelated>true</recordAsRelated>
						<tags>
							<tag>PROD_WP</tag>
						</tags>
					</relatedItem>	
					<relatedItem qualifiedId="caseStudy">
						<filterCriteria>
							<filter>
								<attributeId>products</attributeId>
								<parentAttribute>identity</parentAttribute>
							</filter>
						</filterCriteria>
						<recordAsRelated>true</recordAsRelated>
						<tags>
							<tag>PROD_CS</tag>
						</tags>
					</relatedItem>
				</relatedItems>								
			</relatedItem>
		</relatedItems>
	</itemCorrelationRule>		
</itemCorrelationRules>